source,review,label
Gojek,bajing terlalu lama nunggu nya gojek sialan kalau gak bisa ya minimal bisa di batalin tolol lama2 nunggu baru di bilang dk bisa dk ada driver ngapa tidak awal2,1
Maxim,kecewa berat sih percuma punya fitur ewallet klo smua drivernya di kota makssr gk ada yg make tolong fitur ewalletnya di fungsiin ya kak biar gak kalah saing sm kompetitor sblh,1
Gojek,udaah msen tinggal nunggu tapi tiba di batalin sama driver nya gara jarak jauh krna ongkos lebih murah pdhal kita juga mengerti dan faham suka melebihi ongkos nya,1
Gojek,saya tidak nyaman naik gojek skrg driver gojek skrg banyal pakai knlpot brisik ojol kok kebanyakan gaya,1
Gojek,kenapa yaaa ko sering dapet nya yg jauh jauh terus jmpt nyatolong dong kasian driver nya jmpt ny jauh,1
Gojek,banyak terbantu dalam berbagai kondisi sedikit koreksi terkadang titik tidak sesuai dengan alamat yg ada dan ada driver yg menolak mengambil hanya karena jarak ataupun kemacetan semoga bisa semakin lebih baik demi kenyamanan konsumen trimakasih,1
Gojek,hp saya menggunakan pembaca layar entah kenapa sampai sekarang belum akses untuk mengangkat menerima telepon dari driver gojek hari ini saya menyesal telah mengecewakan 2 driver motor gojek karena persoalan tersebut,1
Gojek,tolong untuk map diperbaikisering tidak sesuai dan membuat hubungan driver dengan penumpang jadi bermasalahtolong it nya kerja untuk memperbaiki masalah map kalo perlu terjun ke lapangan,1
Maxim,tolong buat sistemnya agar bisa memblokir driver agar tdk ketemu lagi dengan driver yang di rasa kurang sopan,1
Maxim,tolong driver car untuk wilayah kota kendarijangan suka naik kan hargadi aplikasi maxim tujuan ke kelurahan sebelah cuma 24 800rpsampai di tujuan jadi 27 ribukadang naik hampir 10 ribukami pengguna maxim jdi ragu menggunakan maxim car,0
Gojek,ini gojek lama bertingkah muluu mana tiap ngasih driver selalu dengan posisi yang paling jauh susah komunikasi pula dan kejadian ini berulang kali,1
Gojek,jadi takut kalo pake voucher hemat disinikalo pakenanti driver nya judesngasih rating customer nya jelekjadi susah dapet driver ga dikasih tips pasti ngomel,1
Gojek,selamat petang ijin bertanya saya gatot supriyanto untuk akun gojek saya kok belum aktif juga ya sdh 4 bulanan belum dipanggil2 kenapa ya,0
Maxim,hari ini saya memakai aplikasi maxim unt pertama kalinya alhamdulillah tdk perlu menunggu lama langsung dapat drivernya dijam sibuk meskipun aplikasi sebelah sampai bikin kesel dibatalin sopirnya ramah nyaman dan harga sangat murah dibanding yg lain terimakasih atas pelayanannya,1
Gojek,aplikasi gak jelas susah cari gocar cancel seenaknya padahal sudah nunggu lama tolong pelayanan diperbaiki g ada kompensasi lagi,1
Gojek,tolong lah untuk biaya aplkikasinya kira aja kasian driver nya terus kadang suka pada gak mau nganter kalo jarak nya jauh karena potongan aplikasinya gede padahal kan customer bayar nya sesuai,1
Gojek,dengan gojekkita bisa kemanapun dan kapanpun kita mauu apalagi dengan tarif yang hemat ayoo buruan cobain gojek guys,1
Maxim,aman nyaman dan ramah di kantong khususnya kalangan pelajar apalagi kalau drivernya ramah dan wangi itu lebih baik sukses selalu jasa maxim luar biasa,1
Maxim,pesan car pdhl pake kode voucher driver minta pembayaran normal car ongkos dekat sering minta cancel bike oke apk paling cepat penjemputan ketimbang aplikasi lain tapi bannyak driver gagap baru terus membahayakan membaca map gelagapan,0
Gojek,tolong diperbaiki maps nya rutenya muter jadi ongkos lebih mahal daripada biasanya drivernya jg lewat jalan biasa dan tidak mengikuti maps nya,0
Gojek,bintang yg berbicara dulu saya pernah tibatiba dapat voucher dari gojek senilai rp 1000000 untuk 10x perjalanan langsung masuk ke akun gojek saya,0
Gojek,tolong yach paylaternya diperbaiki saya sudah bayar itu tagihannya kenapa belum juga muncul notifikasi lunasnya error kok disaat mau limit jatuh tempo klo masih seperti ini aplikasi nya gojek saya tutup selamalamanya terimakasih,0
Gojek,kirain cuman saya ajah ternyata banyak juga yang komplain dikasih driver yang jauh pantesan ga kasian sama driver dan pelanggan sekalian kasih driver dari pulau seberang,1
Gojek,gojek parah dari jam 2 hujan sampe skr jam 6 sore dari miko mall ga ada yg maw ambil malah pada di cancel,0
Gojek,tolong untuk goride di tampilkan apa merk kendaraan nya kalian aplikasi aja mahal tapi kualitas jelek apalagi goride saya selalu dpt motor jelek ga layak jalan,1
Maxim,tolong perbaiki lokasi map nya agar lebih gampang utk driver mencari alamat dan tambahkan fitur foto di dalam obrolan agar driver tau yang mana customer nya,0
Gojek,untuk saat ini kenpa tarif goride sangat mahal tolong di murahin sdikit lah biar pengguna nya ga berpindah ke apk sebelah,1
Gojek,driver gocar terkadang susah untuk nganter konsumen dengan alasan jauh lah jemput nya sebagai nya inti nya driver tidak mau jemput tapi lucu nya saat minta pembatalan harus konsumen yang ngebatalin pada hal konsumen mau menunggu,1
Gojek,sedih akun saya di tuduh penyalahan promo promo pada akun saya hilang padahal teman saya hanya login melalui ponsel dan aplikasi gojek di hp saya memesan makan seharusnya itu tidak masalah karena saya tidak ada membuat akun lain dan hanya punya satu akun,0
Gojek,driver nya lama bangett yg harus nya anter ibu saya cuci darah jam 6 bisa sampe jam 7an,1
Maxim,nunggu penumpang lama bisa kena biaya tambahan nunggu drivernya lama ga bisa kasih jempol ke bawah atau kompensasi lain,1
Gojek,tolong bila mana ada driver cancel kami para penumpang di beri kompensasi dan sebaliknya bila penumpang yang cancel kasih kompensasi ke driver,1
Gojek,udah malas rasanya naik gojek kemarin minggu malam senin subuh ambil voucher tapi gak muncul heran gojek sekarang,0
Maxim,mudah pesan nya dan lebih murahdriver nya juga banyakselama ini belum dapat driver yang rese sih,1
Gojek,tolong evaluasi mapgps dari tadi saya dihubungkan dengan driver yang jauh melulu udah lebih dari 10 kali,0
Gojek,sekarang tarifnya mahal dulu trip yg biasanya 11rb13rb skrg jadi 20rblama2 ku log out juga nih gojek,1
Gojek,tiba2 langganan gojek plus 90 days padahal ngga pernah pakai trial atau apa mana ngga bisa direfund lagi 34rb melayang yang manfaatnya tidak saya ketahui tolong tim gojek balas respon saya saya mau refund bukan pembatalan langganan refund,0
Gojek,aplikasi sangat membantu dan mudah di gunakan dan ya aku pernah go ride cuma bayar 4k tau,1
Gojek,cepat dan mantap proses nya driver nya juga bersahabat hanya kurang promo nya aja nih dari pihak gojeg nya,1
Maxim,tolong dong diperiksa semua driver nyaaa apalagi daerah jambi kalo malam banyak yang pada upping price sampe 2 kali lipat bukan nya ga mampu tapi masa sampe segitu nya,0
Maxim,banyak penyusup hati hati banyak juga yang nipu saya udah 2 kali soal e tetep grabgojek pemenangya ada harga ada kualitas pelayanan juga,1
Gojek,drivernya sekarang belagu banget di hubungin suka ga dibales 10 menit kemudian baru dibales udh jalannya lama banget,1
Gojek,bintang 4 dulu yah kadang kalo ambil gojekgocar hemat driverrider pada ga mau pick up kalo memang tidak menguntungkan untuk para mitra ya ga usah ada gocargojek hemat bikin sebel aja,1
Gojek,sampe sekarang masih keinget pas pesen go car mo ke rumah sakit pas mo di bayar ga mau driver nya baik makasih dah membantusehat dan smoga rejeki berlimpah untuk jenengan pak sopir,0
Maxim,dtng ke sekolah memberi voucher 200rb eh pas dipake ga bisa dan cara pemakaian tidak diberi tau nipu ga si,0
Gojek,gmna ini aflikasi gojek error metode pembayar tunai tpi diaflikasi jdi non tunai satu tujuan dua kali pembayaran,0
Gojek,aplikasi payah kalau pesan gocar drivernya pada gak bergerak dari posisi awal good job maxim dan grab,0
Gojek,overall bagus kadang ada satu dua driver yang kadang nyebelin min info dong di bandara sultan mahmud badaruddin ii palembang udah ada gocar airport belum ya,1
Gojek,maaf mau nanya baru daftar gojek kok tiba tiba nama nya sama email nya bukan punya saya yah padahal nomor hp nya nomor saya yang tahu kenapa tolong bantuannya terimakasih,0
Gojek,kenapa di aplikasi chat dan juga map tidak ada update nya sama sekali merugikan pihak driver dan juga konsumen,1
Maxim,nganterin anak sekolah setelah sampe ada laporan sudah sampe sekolah bu terimakasih pak jrg ada driver seperti ini,1
Gojek,menjangkau area yg jauh dari pangkalan ojek saat urgensi kita butuh transportasi yg cepat terima kasih gojek semoga makin sukses,1
Gojek,tolong turun kan ongkos akhir akhir ini ongkos gojek samgat mahal jika sepi penumpang sekarang itu wajar karena terlalu mahal,1
Gojek,gojek makin lama makin anehh mapsnya jadi ga karuan antra driver dan pelanggan padahal saya pengguna lama tapi menurut saya makin buruk apalagi dibagian maps,1
Gojek,udh d update ngapa susah d buka si pdhl sinyal normal terus slot sama aceng meresahkan tolong hapus program nya enggak enak kalo pesen ke driver nya padahal saya bayar full ke driver nya malah goceng,0
Gojek,terimakasih grabtitik jemput jaminan 5 menit sampemengutamakan pelanggan dan terimakasih gojek berkat anda kami telat jemput nya grab terdepan,0
Gojek,saran untuk kemajuan di 2025 tambahkan fitur pilihan khusu gojek perempuan supaya kami ibu ibu kalau mau pergi boncengnya nyaman dengan sesama wanita lebih mahal yo gak papa kalau milih gojek wanita karna kami cari kenyamanan,1
Gojek,selebihnya sih udh oke tp sebelnya pas hujan mau pesen makan lagi laper nya susah bgt dpt driver pdhal hujan nya udh reda,1
Gojek,udah mahal ongkir dan jasa lama penipu ulung lagi ktanya 3 menit lagi sampe taunya driver baru mau meluncur kacau,1
Gojek,banyak driver ngeluh di bayar 5000 padahal customer bayar ongkir mahalada yaaaa aplikator setega itu sama mitra nya yg jelas membuat nama gojek dri awal ada sampai sekarang bagaimana ini presiden prabowo tolong berikan perlindungan hak hak mereka,1
Gojek,semakin lama semakin tidak memuaskan mudah error susah cari driver dan lama bangettt hrus berjam baru dibatalin oleh sitem,0
Gojek,geudd sering sering banyak voucher jgn pelit juga buat bagiin ongkir ke mitra driver kasian lohh,1
Maxim,terserah driver nya jadi miskin atau tidak makanya sekali kali jadi penumpang biar ngerasain enak tapi aplikasi ini sangat menguntungkan buat saya,1
Gojek,kalau perusahaan yang banyak menipu hasil driver dan pembayaran nya dan bayak melakukan kecurangan biaya kepada customer akhir nya buat app pun seperti di kerjakan oleh tangan haram makin hari makin tidak becus semua kerja karyawan dan teknisi perusahaan goto,1
Maxim,jadi spg maxim ngasih kode voucher pku1 mayan ya waktu di gunakan malah drivernya gak terima dih gak guna mending pindah aja deh pake aplikasi gojek aplikasi maksim penipu,1
Gojek,hai min saya mau komplen kenapa yaa sekarang gojek tuh susah bgt dpet drivernyaa ga kayak dulu langsung cepet dpet sekarang bahkan sampe 30 menitan dpet drivernyaa mohon diperbaiki untuk kendala ini terimakasih,0
Gojek,ga jelas maps nya gocarmasa mobil di suruh masuk gang kecil emangnya motor golektlng perbaiki mas nya jgn buat driver pusing otomatis customer jg lama nunggu nya,1
Maxim,banyak kendaraan roda duanya sudah tidak layak pakai kenapa harus diberikan jadi driver maxim pelayanan dan kenyamanan harus diutamakan,1
Gojek,aplikasi paling is the best aplikasi ini berguna sekali buat orang para pekerja yang pulang kerja nya malam ini bisa banget jadi transportasi online,1
Maxim,tolong dong di perbaiki lagi untuk maps nya saya mau berangkat kerja ada rute yang lebih dekattapi malah otomatis pilih rute terjauhlalu saya sudah blg ke driver nya untuk pilih rute yg lebih dekat dia lebih memilih rute terjauh tolong lah di perbaiki,1
Gojek,gatau kenapa tapi sekarang gojek gak seperti dulu gapernah ada voucher diskon ongkir makin mahal intinyaa udah gak sebagus dulu,1
Gojek,sering di cancel driver tunggu lama stlh itu di cancel kenaikan harga kl driver minta cancel lumayan besar 2x driver minta cancel biaya jd membengkak tolong dong diperbaiki penghitungan kenaikan harga dan driver komitmen dlm ambil penumpang terima kasih,0
Gojek,jadi mahal banget biasanya ke kampus cuma 9k udah make gojek plus baru sekarang jadi 13k padahal udah plus,0
Gojek,kenapa sih chat suka ga bisa di buka udh di pencet chat nya ga mau masuk ke room chat sebel banget mau balas chat driver jd ga bisa,0
Maxim,mantap supir nya pun rama dan baik mobil nya pun bersih dan wagi wak pokok nnya josss x,1
Gojek,bisa di filter lagi ga driver2nya pihak gojek entah mtr atau mobil kalo lagi hujan susah parah tarif naik 50,1
Gojek,ga pernah telat bayar paylater malah di block paylater nya tanpa pemberitahuan terlebih dahulu chat ke gojeknya malah robot yg jawab kecewa bgt udah mending uninstall ajaa,0
Maxim,sejauh ini saya dapat driver yg baik ramah terimakasih untuk para driver maxim atas pengalaman hidup yg sangat berarti skali lagi trimakasih,1
Maxim,sangat bangga dan harga sangat terjangkau buat masyarakat menengah kebawah di bandingkan ojol lain lain top lah,1
Gojek,saya sangat kecewa sekarang pencarian driver mobil xl sangat susah banyak tanya brp orng kalau di jwb 5 langsung minta cancel padhl gocar nya tipe xl,0
Gojek,aku harap penumpang bisa melihat ratingnya di gojek bukan hanya driver yang bis lihat jadi misalnya jika ada penyebab rating jelek penumpang bisa memperbaiki nya,1
Gojek,sangat membantu limit paylatter nya okeh slama kita lancar pembayaran cepet naik limit okeh pokonya,1
Gojek,nyari bokingan lama padahal driver nya lagi pada nongkrong ramean masa kaga ada satupun yang di acc,1
Gojek,uda 4x download apk gojek pas vermuk selalu gagalsmpai bosen q download hapus download hapus smpai 4x mau masuk aja kok susah skli,0
Gojek,drivernya ga jelas selalu minta cancel alasan titik penjemputan jauh kalau saya cancel saya dapet driver makin lama kalau dilanjut drivernya yg minta cancel enakan pake ijo sebelah drivernya jarang cancel dan lebih sabar plus mobilnya bersih app ini mobilnya pada bau rokok,1
Gojek,ini gojek kenapa ya sekarang saya pakai akun baru biasanya suka ada voucher tapi voucher goride sekarang tidak ada tapi giliran saya beralih ke gocar ada 2 voucher tapi pas giliran saya buka voucher ternyata tidak ada voucher apakah bug tolong di perbaiki lahi,0
Gojek,sudah 45 menit saya mesan gocar semuanya tidak bergerak mobilnya saya kehujanan mau bekerja apa memang drivernya begitu tolong di pantau,0
Maxim,aplikasi gak guna jangan didownload ngak sesuai aplikasinya saya mau mencari tujuan ngak keluar sama sekali tidak jelas alamatnya,0
Gojek,tolong diperbaiki maps nya sekarang sering tdk sesuai titik lokasi jauh pula akibatnya sering debat ama driver,1
Gojek,gojek tolong perbaiki dong saya heran banget saya udah cancel ojek malah dikasih makin jauh lokasinya kan heran orang mau kemana mana gak bisa ngendelin gojek,1
Gojek,bagus hanya saja kadang dapat driver yang ugalugalanaku sampai jatuh tp gak ada tanggung jawabnyadan dpt juga yg agak kurang baikduduk nya mepet2 saya sampai mau jatuh untung aja jaraknya dekat kepala ku sampai sekarang masih sakitsaya cs dari wilayah sidoarjo,1
Gojek,pengen kasih bintang 1 kalau ada driver yang masih menuju lokasi jemput tapi di aplikasi sudah bersama penumpang ga di briefing dulu gitu para driver nya,1
Gojek,khusus driver gocar susah setengah mati kalo tarif murah sering di batalin buat apa lu jadi mitra,1
Maxim,baik sekali drivernya ramah tidak sombong sangat membantu terimakasih banyak ya pak semoga kebaikannya di balas oleh allah,1
Gojek,tolong lah di update yg bener cari lokasi aja selalu ke arah sebaliknya cari driver berjam jam sampe di cancel mulu mendadak sama driver nya pelayanan nya buruk sekali aplikasi ini,0
Gojek,dulu sempet hapus gojek sekarang setelah download gojek susah masuk karena harus verifikasi wajah udah nyoba banyak kali tetep gabisa soalnya dulu waktu hapus gojek belum verifikasi wajah minta tolong ya karena saya mau pake gojek secepatnya,0
Maxim,pengemudi khofifatus sholihah dengan motorcycle warna putih nopol s3878or selamat menikmati perjalanan anda rating 400 pengemudi khofifatus sholihah dengan motorcycle warna putih nopol s3878or selamat menikmati perjalanan anda rating 400,0
Gojek,gojek tolong buat fitur memberi tip ke driver saya kemarin mau memberi tip ga sengaja keluar terus gabisa ngasih tip lagi,1
Gojek,apknya bagus cuman ini ada saran dari saya tolong adain fitur ganti ratingbintang saya pernah salah kasih rating karena hp error padahal mau kasih bintang 5 kasian drivernya,1
Gojek,tolong diperbaiki lagi untuk driver nya biar kita nunggu engga terlalu lama karna driver tidak tahu jalan nya,1
Maxim,kak bagaimana cara daftar maxim audah berulang kali di daftar lewat pesan telpn bahkan pake kode perfikasi tetap tdk bisa,0
Gojek,membantu utk transportasi lbh cepat mudah semoga lbh sering utk hrg discpromo jg keamanan attitude drivernya spy ttp baik tdk mengendor sukses,1
Gojek,banyak diskon dan promo menarik yang cocok di saku pelajarmahasiswa saya sangat terbantu menuju lokasi magang terima kasih gojek,1
Gojek,suka bngt pake apk ini hanya saja pasti di pihak gojek sudah ada data mobil atau motor driver tolong jika pelanggan pesan comfort atau xl ya yg beneran jangan malah dikasih yang ga sesuai atau yg kecil sedikit kecewa tentang ini,0
Gojek,dengan adanya gojeksaya khususnyasangat terbantu kalau lg malas keluar rmhsmg pelayanannya trus ditingkatkandari baik menjadi lbh baik lgmaksh gojek,1
Gojek,membantu perjalanan dan banyak promo nya semoga semakin banyak terus promonya tapi tetap tidak merugikan driver,1
Gojek,sudah pesen 2 kali dan nunggu berjamjam tidak bisa dicancel setelah nunggu lama banget gojek baru tercancel secara otomatis tanpa bisa konfirmasi ke cs melalui aplikasi nya,0
Gojek,makin kesini makin jelek driver suka telat yang harus nya dateng jam 605 tp belum jalan anak sekolah dibikin telattt muluu belagu bgt ujan dikit sepi bgt gada yg ambil kalo kaya gitu mah skrg pindah ke grab atau maxxim,1
Maxim,aplikasi tidak d sertai laporan darurat sehingga sulit untuk melakukan pengadun atas tindakan pelanggaran yg mungkin di lakukan driver2 nakal,0
Gojek,gw sangat kecewa dgn banyak nya driver gocar pd sombong di saat hujan deras mereka malah nolak rejeki klw lo gk mw narik matiin aja hp lo byutusan langit,1
Maxim,susah buat ketemu driver sering salah alamat kalo di tempat baru lebih bagus kalo ada fitur kameranya dev,1
Gojek,kenapa ya saya kalo pesen selalu di cancle sampe 5x loh udah buru buru tolong ya ini gojek,0
Maxim,rata2 driver tidak ramah selalu menggunakan kata2 gk sopan terhadap costumer emosi habis saya tolong di optimalkan lagi pelayanan nya ganti driver nya driver mana coba kasar ke costumer nya tolong bgt biasakan sopan sama costumer inget itu,1
Gojek,download susah banget apk gojek padahal dapat membantu dan meringankan masyarakat karna tidak ada kendaraan terus menggunakan jasa layananan online ini gojek perbaiki lagi yang punyak aplikasi gojek,1
Gojek,tolong mas mba nya bagian operator aplikasi gojek saya minta kalau mencari driver itu yg cepet karna kalau pesan gojek pas lagi buru2 itu biasanya lama tolong diperbaiki lagi,1
Gojek,2 kali pesen nunggu 2 jam lebih gak dapet driver pas mau di batalin malah di tolak sama gojeknya maksud nyaa apaahh yaaaa keburu tengah malem nungguin nyaaaa,0
Gojek,sangat membantudi saat mau pergi kemana2 pas lagi ga ada kendaraan d rumah tarif nya terjangkau,0
Gojek,akun saya tibatiba tidak bisa login ya allah padahal pencarian rezeki saya hanya digojek ini udah berjuang membangun nama gojek ini sampai sukses,0
Gojek,udh lama bgt sampenya pdhal deket eh drivernya ngluh ongkos 5rb doank pdhal saya bayar full umr naik driver masa cuma 5rban,1
Gojek,makin update makin parah sampai gak bisa lihat gojek nya sudah jalan apa belum atau sampai mana tolong perbaiki lagi,0
Gojek,maaf apakah ada yg mengalami kendala yg sama dg saya terkadang saya gak bs klik unt membuka chat dan telp dr gojek tidak berdering apakah krn gangguan sinyal atau bagaimana,0
Maxim,anugerah dewantoro trima kasih banyak ya mas sangat membantu banget tahu banget rutenya pelayanan ramah good job mugi gusti tansyah maringi rejeki lancar ksehatan juga keselamatan aamiin,1
Maxim,terimakasih pak semoga sehat dan di lancarkan rezekinyaa amiinn sangat bagus musik yg bagus pengemudi dengan hati hati pengemudi sopan tiba dengan cepat bersih rapi,1
Maxim,tolong pemilihan driver nya lebih diseleksi lagi laah orang tua atau aki kalo bisa dihold dulu udah 2x ngalamin dapet orang tua jalanya lelet ngantukan kagetan pula,0
Gojek,ketika pas tidak ada kendaraan pribadi gojek memudahkan transportasi ke tempat tujuan dg cepat terimakasih gojek,0
Gojek,oi minimal klo udh boking gocar atau grab klo di waktu hujan itu cepat dapat lah apalgi di pagi jam 3 lama bgt dapat nya mana dpt nya jauh pda gamau kesel bgt gw,1
Gojek,sudah 2 kali pesan gocar alamat tujuan dari aplikasi tidak sesuai dengan yang saya pesan setelah saya edit alamat tujuannya ongkosnya naik lebih dari 2 kali lipat,0
Gojek,kalau tidak pakai promo ongkos masih kemahalan buat customerdan terlalu rendah yg di terima driver tolong kebijakan biar saling menguntungkan,1
Gojek,kenapa sekarang makin sulit customer wajib vermuk kamera saya rusak gmn cara makai apk nya sangat kecewa,1
Gojek,sekarang susah banget dapet driver mereka terlalu pilih pilih males pdhl saya selalu kasih tips udah bertahun tahun pake skrg kesel banget drivernya kalo gamau pick up yaudah langsung cancel aja jngn dibiarin kita nunggu lama lama gak gerak gerak gak mau konfirmasi juga,1
Maxim,driver buruktarif tidak sesuai suruh tambah ongkosnya mending gak usah installmurah hanya diaplikasi real nya driver minta tambah,1
Gojek,pesan gocar sampe berjam nggak ada yang mau padahal banyak driver di sekitar apa mungkin karna argo kecil jadi pada ga mau ambil kecewa aja sih sama apps ini bukannya memudahkan tapi malah gajelas,1
Gojek,sering pakai gojek malah makin mahal gmn sih ini pakai diskon bukan nya murah malah naik harga hadeh,1
Gojek,boking dari pukul 3 sampe pukul 5 tidak dapat driverkenapa kalo boking sekarang lamadan sampe berkali kalimuncul keterangan wadidaw kebanyakan pencetpadahal kami tidak mencetmohon dimudahkan kembali,0
Gojek,saya sebagai customer lama2 kecewa sama ini aplikasimau pakai layanannya jadi segan kasianan ke driver saya pakai tarif normal tapi ini kenapa ke driver hanya dapat uangnya 45 dari yang saya bayar,1
Gojek,pelayanan aplikasi nya buruk bgt selalu dicariin driver dari titik yg sangat jauh padahal dket titik jemput banyak tolong deh di bnerin lagi kinerjanya jgn ky orang amatiran baru kemarin bikin aplikasi deh,1
Gojek,aplikasi mau untung besar saya byar normal driver di kasih gocengoia klo pilih it tolong jgn ya magang yamau untung bnyak sring eror sistem,1
Gojek,kebanyakan di cancel rata rata gojek ad yg ngebales chat tpi ujung ujungnya ttp di cancel setelah 35 menit buang waktu,0
Gojek,gojek lagi ngeruk keuntungan pelanggan bayar 15rb driver terima cuma 5rb astaga gojek pantrs drivermu pada ngeluh semua aplikasi meres tenaga org lama2 habis pelanggan mu gojek,1
Maxim,driver nya ngga taat aturan lalu lintas udah tau macet eh dia nyelonong hampir nabrak orang dikasih tau malah marah aneh,1
Gojek,update peta nya bagus kl ada peeubahan lgsg di apdet peta nya drpd app sebelah cmn promo nya kurang ya terus diperbaiki ya gojek,1
Maxim,driver mobilnya sombongsombong semua kecuali dinaikin harganya baru mau kalau memang niatnya ga mau sesuai aplikasi ga usah make maxim,1
Maxim,kami driver tersiksa udah bayaran kecil salah penumpang dan penumpang laporin yg gak2 kami yang kena pbo aplikasi teraneh setidaknya ikutinlah gojek shoope lebih menjaga mitranya,1
Maxim,ekonomis untuk aplikasi maxim penumpang maps nya masih kurang kumplit jadi untuk menentukan titik masih agak susah,1
Gojek,kebiasaan banget ini gojek tiap bru ujan selalu susah cari driver berkali ga dapet mana lamaaaaa bangettt pdhl ujan aja ga besar amat dan ud berenti beginiii bagian dapet driver jauhhh,1
Maxim,aku suka sama bapa nya lemah lembut sopan baik banget enak bawa motor nya pelan gitu thee besttt buat bapa semoga dapet menumpang banyak semoga lancar rezeki nya aamiin,1
Gojek,smua psaing mu itu ga perna naikin tarif pas hari penting cntoh hari raya dan hari besar ca elu doang jek yg ga waras mntang2 hari besar tarif naik seenak jidat dikira cust lo tu orang bduit smua apa gmn b1 utk apk ampas,1
Gojek,menurut pendapat subyektif kami pihak pengelola app ini memperlakukan kami dgn diskriminatif dan tdk memberika pelayanan yg terbaik seprti costumer lain semoga masukan ini dpt menjadikan bahan evaluasi demi kemajuan app ini semoga driver dan costumer yg membaca ini selalu sehat dan sukses,1
Maxim,sangat tidak worth it masa iya sudah siang driver nya tidak ada kembalian uang dan ada yang tidak menggunakan seragam maxim saya kecewa sudah berkali kali kena di maxim ini,1
Gojek,depan kantor aja pendaftaran driver ditutup ternyata eh ternyata tetep aja masih buka pendaftaran dengan alasan opang grab vip dll kantor jangan hanya mau di perhatikan tapi driver jga sebagai mitra harus di perhatikan udah tarif nya murah suspend pm tanpa pemberitahuan kepada driver,0
Gojek,gojek kalau mau drivernya ngebahagian keluarganya jangan cuma suruh customer kasih tips dong tapi jangan gede gede potongannya pantes banyak driver minta bayaran offline,1
Gojek,aplikasi nya curang kami kaseh ongkos mahal 18000 kedrivernya cuma dapet 5000 kasian sekali para drivernya,1
Gojek,kalau semisalnya gocar gabisa tuh jangan diterima cobaudah nunggu hampir sejam gocarnya diem aja ga gerakudah beberapa kali pesen diterima ga gerak gerak aneh,0
Gojek,titik perjalanan lemot di map nya jd sulit melihat lokasi supirnya udah sampai dimana pdhl sudah di update ke versi terbaru tapi msh lemot aplikasinya tolong diperbaiki lagi,0
Gojek,licik banget notifnya ga bisa matiin notif promo cuma pengin terima notif perjalanan pilihannya cuma nyalain atau matiin semua notif di settingnya 2 bintang lagi untuk setelah ada kategorisasi notif yang jelas,1
